{
  "schema_version": "1.0",
  "validation_id": "VAL-FACTORY-STEP9-20260918191059",
  "validator": "drupal-migration:factory-self-validation",
  "executed_at": "2026-09-18T19:10:59.988893+00:00",
  "summary": {
    "checks_total": 89,
    "passed": 87,
    "failed": 0,
    "warnings": 1,
    "unverified": 1
  },
  "checks": [
    {
      "check_id": "CHECK-STR-01",
      "category": "packaging",
      "name": "Claude Plugin Manifest Fields",
      "status": "PASS",
      "evidence": "Valid plugin.json v1.0.0 with name 'drupal-migration-agent'",
      "details": "Verified manifest JSON and required metadata keys.",
      "affected_files": [
        ".claude-plugin/plugin.json"
      ],
      "remediation": ""
    },
    {
      "check_id": "CHECK-STR-02",
      "category": "packaging",
      "name": "Marketplace Catalog Manifest",
      "status": "PASS",
      "evidence": "Valid marketplace catalog with 1 plugin entry",
      "details": "Verified optional marketplace.json catalog syntax.",
      "affected_files": [
        ".claude-plugin/marketplace.json"
      ],
      "remediation": ""
    },
    {
      "check_id": "CHECK-STR-03",
      "category": "packaging",
      "name": "Distribution Portability & Absolute Path Sanitization",
      "status": "PASS",
      "evidence": "Zero unescaped machine-specific absolute paths detected across all repository files.",
      "details": "Verified repository portability across operating systems.",
      "affected_files": [],
      "remediation": ""
    },
    {
      "check_id": "CHECK-STR-04",
      "category": "packaging",
      "name": "Canonical Configuration Template",
      "status": "PASS",
      "evidence": "migration.config.example.yml exists with all required configuration sections and zero embedded credentials.",
      "details": "Verified canonical configuration template for consumer onboarding.",
      "affected_files": [
        "migration.config.example.yml"
      ],
      "remediation": ""
    },
    {
      "check_id": "CHECK-AGT-orchestrator",
      "category": "agents",
      "name": "Agent Operational Contract (orchestrator)",
      "status": "PASS",
      "evidence": "All 18 sections, frontmatter, source protection, and state authority verified.",
      "details": "Agent orchestrator complies fully with operational specification.",
      "affected_files": [
        "agents/orchestrator/agent.md"
      ],
      "remediation": ""
    },
    {
      "check_id": "CHECK-AGT-discovery",
      "category": "agents",
      "name": "Agent Operational Contract (discovery)",
      "status": "PASS",
      "evidence": "All 18 sections, frontmatter, source protection, and state authority verified.",
      "details": "Agent discovery complies fully with operational specification.",
      "affected_files": [
        "agents/discovery/agent.md"
      ],
      "remediation": ""
    },
    {
      "check_id": "CHECK-AGT-dependency",
      "category": "agents",
      "name": "Agent Operational Contract (dependency)",
      "status": "PASS",
      "evidence": "All 18 sections, frontmatter, source protection, and state authority verified.",
      "details": "Agent dependency complies fully with operational specification.",
      "affected_files": [
        "agents/dependency/agent.md"
      ],
      "remediation": ""
    },
    {
      "check_id": "CHECK-AGT-contrib-module",
      "category": "agents",
      "name": "Agent Operational Contract (contrib-module)",
      "status": "PASS",
      "evidence": "All 18 sections, frontmatter, source protection, and state authority verified.",
      "details": "Agent contrib-module complies fully with operational specification.",
      "affected_files": [
        "agents/contrib-module/agent.md"
      ],
      "remediation": ""
    },
    {
      "check_id": "CHECK-AGT-custom-module",
      "category": "agents",
      "name": "Agent Operational Contract (custom-module)",
      "status": "PASS",
      "evidence": "All 18 sections, frontmatter, source protection, and state authority verified.",
      "details": "Agent custom-module complies fully with operational specification.",
      "affected_files": [
        "agents/custom-module/agent.md"
      ],
      "remediation": ""
    },
    {
      "check_id": "CHECK-AGT-custom-theme",
      "category": "agents",
      "name": "Agent Operational Contract (custom-theme)",
      "status": "PASS",
      "evidence": "All 18 sections, frontmatter, source protection, and state authority verified.",
      "details": "Agent custom-theme complies fully with operational specification.",
      "affected_files": [
        "agents/custom-theme/agent.md"
      ],
      "remediation": ""
    },
    {
      "check_id": "CHECK-AGT-configuration",
      "category": "agents",
      "name": "Agent Operational Contract (configuration)",
      "status": "PASS",
      "evidence": "All 18 sections, frontmatter, source protection, and state authority verified.",
      "details": "Agent configuration complies fully with operational specification.",
      "affected_files": [
        "agents/configuration/agent.md"
      ],
      "remediation": ""
    },
    {
      "check_id": "CHECK-AGT-data-migration",
      "category": "agents",
      "name": "Agent Operational Contract (data-migration)",
      "status": "PASS",
      "evidence": "All 18 sections, frontmatter, source protection, and state authority verified.",
      "details": "Agent data-migration complies fully with operational specification.",
      "affected_files": [
        "agents/data-migration/agent.md"
      ],
      "remediation": ""
    },
    {
      "check_id": "CHECK-AGT-api-modernization",
      "category": "agents",
      "name": "Agent Operational Contract (api-modernization)",
      "status": "PASS",
      "evidence": "All 18 sections, frontmatter, source protection, and state authority verified.",
      "details": "Agent api-modernization complies fully with operational specification.",
      "affected_files": [
        "agents/api-modernization/agent.md"
      ],
      "remediation": ""
    },
    {
      "check_id": "CHECK-AGT-integration",
      "category": "agents",
      "name": "Agent Operational Contract (integration)",
      "status": "PASS",
      "evidence": "All 18 sections, frontmatter, source protection, and state authority verified.",
      "details": "Agent integration complies fully with operational specification.",
      "affected_files": [
        "agents/integration/agent.md"
      ],
      "remediation": ""
    },
    {
      "check_id": "CHECK-AGT-testing",
      "category": "agents",
      "name": "Agent Operational Contract (testing)",
      "status": "PASS",
      "evidence": "All 18 sections, frontmatter, source protection, and state authority verified.",
      "details": "Agent testing complies fully with operational specification.",
      "affected_files": [
        "agents/testing/agent.md"
      ],
      "remediation": ""
    },
    {
      "check_id": "CHECK-AGT-validation",
      "category": "agents",
      "name": "Agent Operational Contract (validation)",
      "status": "PASS",
      "evidence": "All 18 sections, frontmatter, source protection, and state authority verified.",
      "details": "Agent validation complies fully with operational specification.",
      "affected_files": [
        "agents/validation/agent.md"
      ],
      "remediation": ""
    },
    {
      "check_id": "CHECK-AGT-final-audit",
      "category": "agents",
      "name": "Agent Operational Contract (final-audit)",
      "status": "PASS",
      "evidence": "All 18 sections, frontmatter, source protection, and state authority verified.",
      "details": "Agent final-audit complies fully with operational specification.",
      "affected_files": [
        "agents/final-audit/agent.md"
      ],
      "remediation": ""
    },
    {
      "check_id": "CHECK-HND-orchestrator",
      "category": "agents",
      "name": "Agent Handoff Integrity (orchestrator)",
      "status": "PASS",
      "evidence": "Downstream handoffs target valid lifecycle agents/roles: ['final-audit']",
      "details": "Verified relational workflow continuity.",
      "affected_files": [
        "agents/orchestrator/agent.md"
      ],
      "remediation": ""
    },
    {
      "check_id": "CHECK-HND-discovery",
      "category": "agents",
      "name": "Agent Handoff Integrity (discovery)",
      "status": "PASS",
      "evidence": "Downstream handoffs target valid lifecycle agents/roles: ['dependency']",
      "details": "Verified relational workflow continuity.",
      "affected_files": [
        "agents/discovery/agent.md"
      ],
      "remediation": ""
    },
    {
      "check_id": "CHECK-HND-dependency",
      "category": "agents",
      "name": "Agent Handoff Integrity (dependency)",
      "status": "PASS",
      "evidence": "Downstream handoffs target valid lifecycle agents/roles: ['contrib-module', 'orchestrator']",
      "details": "Verified relational workflow continuity.",
      "affected_files": [
        "agents/dependency/agent.md"
      ],
      "remediation": ""
    },
    {
      "check_id": "CHECK-HND-contrib-module",
      "category": "agents",
      "name": "Agent Handoff Integrity (contrib-module)",
      "status": "PASS",
      "evidence": "Downstream handoffs target valid lifecycle agents/roles: ['orchestrator']",
      "details": "Verified relational workflow continuity.",
      "affected_files": [
        "agents/contrib-module/agent.md"
      ],
      "remediation": ""
    },
    {
      "check_id": "CHECK-HND-custom-module",
      "category": "agents",
      "name": "Agent Handoff Integrity (custom-module)",
      "status": "PASS",
      "evidence": "Downstream handoffs target valid lifecycle agents/roles: ['testing', 'validation']",
      "details": "Verified relational workflow continuity.",
      "affected_files": [
        "agents/custom-module/agent.md"
      ],
      "remediation": ""
    },
    {